create table employee(
    -> empid int primary key,
    -> name varchar(25),
    -> dept varchar(25),
    -> salary int,
    -> joindata date
    -> );
Query OK, 0 rows affected (0.09 sec)

mysql> select*from employee
    -> ;
Empty set (0.04 sec)

mysql> desc employee;
+----------+-------------+------+-----+---------+-------+
| Field    | Type        | Null | Key | Default | Extra |
+----------+-------------+------+-----+---------+-------+
| empid    | int         | NO   | PRI | NULL    |       |
| name     | varchar(25) | YES  |     | NULL    |       |
| dept     | varchar(25) | YES  |     | NULL    |       |
| salary   | int         | YES  |     | NULL    |       |
| joindata | date        | YES  |     | NULL    |       |
+----------+-------------+------+-----+---------+-------+
5 rows in set (0.03 sec)

insert into employee(empid, name, dept, salary, joindata) values
    ->      (1, 'blessy', 'finance', 50000, '2023-06-12'),
    ->      (2, 'shivss', 'marketing', 45000, '2023-02-02'),
    ->      (3, 'anushri', 'HR', 42000, '2022-05-01'),
    ->      (4, 'mohana', 'finance', 22000, '2021-03-08'),
    ->      (5, 'sahana', 'marketing', 35000, '2023-06-19'),
    ->      (6, 'indhu', 'wd', 50000, '2023-10-5')
    ->      ;
Query OK, 6 rows affected (0.03 sec)
Records: 6  Duplicates: 0  Warnings: 0 

mysql> select * from employee;
+-------+---------+-----------+--------+------------+
| empid | name    | dept      | salary | joindata   |
+-------+---------+-----------+--------+------------+
|     1 | blessy  | finance   |  50000 | 2023-06-12 |
|     2 | shivss  | marketing |  45000 | 2023-02-02 |
|     3 | anushri | HR        |  42000 | 2022-05-01 |
|     4 | mohana  | finance   |  22000 | 2021-03-08 |
|     5 | sahana  | marketing |  35000 | 2023-06-19 |
|     6 | indhu   | wd        |  50000 | 2023-10-05 |
+-------+---------+-----------+--------+------------+
6 rows in set (0.00 sec)

select * from employee where
    -> dept = 'HR';
+-------+---------+------+--------+------------+
| empid | name    | dept | salary | joindata   |
+-------+---------+------+--------+------------+
|     3 | anushri | HR   |  42000 | 2022-05-01 |
+-------+---------+------+--------+------------+
1 row in set (0.03 sec)

 update employee
    -> set dept ='web'
    -> where name = 'blessy';
Query OK, 1 row affected (0.04 sec)
Rows matched: 1  Changed: 1  Warnings: 0

mysql> select*from employee;
+-------+---------+-----------+--------+------------+
| empid | name    | dept      | salary | joindata   |
+-------+---------+-----------+--------+------------+
|     1 | blessy  | web       |  50000 | 2023-06-12 |
|     2 | shivss  | marketing |  45000 | 2023-02-02 |
|     3 | anushri | HR        |  42000 | 2022-05-01 |
|     4 | mohana  | finance   |  22000 | 2021-03-08 |
|     5 | sahana  | marketing |  35000 | 2023-06-19 |
|     6 | indhu   | wd        |  50000 | 2023-10-05 |
+-------+---------+-----------+--------+------------+
6 rows in set (0.00 sec)

 update employee
    -> set salary = 22000
    -> where name = 'indhu';
Query OK, 1 row affected (0.04 sec)
Rows matched: 1  Changed: 1  Warnings: 0

mysql> select*from employee;
+-------+---------+-----------+--------+------------+
| empid | name    | dept      | salary | joindata   |
+-------+---------+-----------+--------+------------+
|     1 | blessy  | web       |  50000 | 2023-06-12 |
|     2 | shivss  | marketing |  45000 | 2023-02-02 |
|     3 | anushri | HR        |  42000 | 2022-05-01 |
|     4 | mohana  | finance   |  22000 | 2021-03-08 |
|     5 | sahana  | marketing |  35000 | 2023-06-19 |
|     6 | indhu   | wd        |  22000 | 2023-10-05 |
+-------+---------+-----------+--------+------------+
6 rows in set (0.00 sec)

rename table employee to emp;
Query OK, 0 rows affected (0.07 sec)

mysql> desc emp;
+----------+-------------+------+-----+---------+-------+
| Field    | Type        | Null | Key | Default | Extra |
+----------+-------------+------+-----+---------+-------+
| empid    | int         | NO   | PRI | NULL    |       |
| name     | varchar(25) | YES  |     | NULL    |       |
| dept     | varchar(25) | YES  |     | NULL    |       |
| salary   | int         | YES  |     | NULL    |       |
| joindata | date        | YES  |     | NULL    |       |
+----------+-------------+------+-----+---------+-------+
5 rows in set (0.00 sec)

alter table emp
    -> rename column joindata to joindate;
Query OK, 0 rows affected (0.07 sec)
Records: 0  Duplicates: 0  Warnings: 0

mysql> select*from emp;
+-------+---------+-----------+--------+------------+
| empid | name    | dept      | salary | joindate   |
+-------+---------+-----------+--------+------------+
|     1 | blessy  | web       |  50000 | 2023-06-12 |
|     2 | shivss  | marketing |  45000 | 2023-02-02 |
|     3 | anushri | HR        |  42000 | 2022-05-01 |
|     4 | mohana  | finance   |  22000 | 2021-03-08 |
|     5 | sahana  | marketing |  35000 | 2023-06-19 |
|     6 | indhu   | wd        |  22000 | 2023-10-05 |
+-------+---------+-----------+--------+------------+
6 rows in set (0.00 sec)

show databases;
+--------------------+
| Database           |
+--------------------+
| emp                |
| employee           |
| information_schema |
| mysql              |
| performance_schema |
| student            |
| sys                |
| world              |
+--------------------+
8 rows in set (0.00 sec)

mysql> drop database sys;
Query OK, 101 rows affected (0.19 sec)

mysql> show databases;
+--------------------+
| Database           |
+--------------------+
| emp                |
| employee           |
| information_schema |
| mysql              |
| performance_schema |
| student            |
| world              |
+--------------------+
7 rows in set (0.00 sec)

delete from emp
    -> where dept = 'wd';
Query OK, 1 row affected (0.04 sec)

mysql> select*from emp;
+-------+---------+-----------+--------+------------+
| empid | name    | dept      | salary | joindate   |
+-------+---------+-----------+--------+------------+
|     1 | blessy  | web       |  50000 | 2023-06-12 |
|     2 | shivss  | marketing |  45000 | 2023-02-02 |
|     3 | anushri | HR        |  42000 | 2022-05-01 |
|     4 | mohana  | finance   |  22000 | 2021-03-08 |
|     5 | sahana  | marketing |  35000 | 2023-06-19 |
+-------+---------+-----------+--------+------------+
5 rows in set (0.00 sec)

 select * from emp
    -> order by salary desc;
+-------+---------+-----------+--------+------------+
| empid | name    | dept      | salary | joindate   |
+-------+---------+-----------+--------+------------+
|     1 | blessy  | web       |  50000 | 2023-06-12 |
|     2 | shivss  | marketing |  45000 | 2023-02-02 |
|     3 | anushri | HR        |  42000 | 2022-05-01 |
|     5 | sahana  | marketing |  35000 | 2023-06-19 |
|     4 | mohana  | finance   |  22000 | 2021-03-08 |
+-------+---------+-----------+--------+------------+
5 rows in set (0.00 sec)

mysql> select * from emp
    -> order by salary asc;
+-------+---------+-----------+--------+------------+
| empid | name    | dept      | salary | joindate   |
+-------+---------+-----------+--------+------------+
|     4 | mohana  | finance   |  22000 | 2021-03-08 |
|     5 | sahana  | marketing |  35000 | 2023-06-19 |
|     3 | anushri | HR        |  42000 | 2022-05-01 |
|     2 | shivss  | marketing |  45000 | 2023-02-02 |
|     1 | blessy  | web       |  50000 | 2023-06-12 |
+-------+---------+-----------+--------+------------+
5 rows in set (0.00 sec)

select * from emp
    -> where dept = 'finance' or dept = 'HR';
+-------+---------+---------+--------+------------+
| empid | name    | dept    | salary | joindate   |
+-------+---------+---------+--------+------------+
|     3 | anushri | HR      |  42000 | 2022-05-01 |
|     4 | mohana  | finance |  22000 | 2021-03-08 |
+-------+---------+---------+--------+------------+
2 rows in set (0.00 sec)

select * from emp
    -> where dept = 'marketing' and salary < 50000;
+-------+--------+-----------+--------+------------+
| empid | name   | dept      | salary | joindate   |
+-------+--------+-----------+--------+------------+
|     2 | shivss | marketing |  45000 | 2023-02-02 |
|     5 | sahana | marketing |  35000 | 2023-06-19 |
+-------+--------+-----------+--------+------------+
2 rows in set (0.04 sec)

select name, dept, joindate
    -> from emp
    -> where dept = 'finance' and joindate > 2023-06-01
    -> order by joindate desc;
+--------+---------+------------+
| name   | dept    | joindate   |
+--------+---------+------------+
| mohana | finance | 2021-03-08 |
+--------+---------+------------+
1 row in set, 1 warning (0.05 sec)

